family,title,abstract,applicants,inventors,dates,classes
68161100,"Modified Cell Expansion and Uses Thereof","The present disclosure relates to compositions and methods for enhancing T cell response and/or CAR cell expansion and/or maintenance in vivo and/or in vitro. For example, a method of enhancing T cell-based therapy comprises administering genetically modified T cells comprising a first chimeric antigen receptor (CAR) and a second CAR, wherein a binding domain of the first CAR binds a first antigen, and a binding domain of the second CAR binds a second antigen. The first antigen is different from the second antigen. In embodiments, the first CAR binds a surface molecule or antigen of a white blood cell.",innovative cellular therapeutics co ltd[cn],xiao lei[us]; cao zhiyuan[cn]; pu chengfei[cn]; sun he[cn],20210318,A61K35/17;A61K35/17;A61K38/191;A61K38/191;A61K38/204;A61K38/204;A61K38/208;A61K38/208;A61K39/001102;A61K39/001112;A61K39/00117;A61P35/00;A61P35/00;C07K14/7051;C07K14/7051;C07K14/82;C07K14/82;C07K16/2803;C07K16/2818;C07K16/3092;C12N15/86;A61K2039/5156;A61K2039/5158;C07K2317/622;C07K2319/03;C07K2319/33;C12N2740/16043
19186716,"Novel full length cDNA","Novel full-length cDNAs are provided. 1970 cDNA derived from human have been isolated. The full-length nucleotide sequences of the cDNA and amino acid sequences encoded by the nucleotide sequences have been determined. Because the cDNA of the present invention are full-length and contain the translation start site, they provide information useful for analyzing the functions of the polypeptide.",res ass for biotechnology,isogai takao[jp]; sugiyama tomoyasu[jp]; otsuki tetsuji[jp]; wakamatsu ai[jp]; sato hiroyuki[jp]; ishii shizuko[jp]; yamamoto jun-ichi[jp]; isono yuuko[jp]; hio yuri[jp]; otsuka kaoru[jp]; nagai keiichi[jp]; irie ryotaro[jp]; tamechika ichiro[jp]; seki naohiko[jp]; yoshikawa tsutomu[jp]; otsuka motoyuki[jp]; nagahari kenji[jp]; masuho yasuhiko[jp],20060209,C07K14/47
67441685,"ANTI-TCR ANTIBODY MOLECULES AND USES THEREOF","The disclosure provides antibody molecules that bind to TCR Vβ regions and multispecific molecules comprising said antibody molecules. Additionally, disclosed are nucleic acids encoding the same, methods of producing the aforesaid molecules, pharmaceutical compositions comprising aforesaid molecules, and methods of treating a cancer using the aforesaid molecules.",elstar therapeutics inc[us],tan seng-lai[us]; vash brian edward[us]; hsu jonathan[us]; gunasekera dilini charmain[us]; palakurthi sangeetha sagar[us]; loew andreas[us],20210909,A61K35/17;A61P35/00;A61P35/00;C07K16/2803;C07K16/2809;C07K16/2809;C07K16/283;C07K16/2878;C12N5/0634;A61K2039/505;A61K2039/505;C07K2317/24;C07K2317/31;C07K2317/31;C07K2317/55;C07K2317/622;C07K2317/92;C07K2317/92
27785577,"Novel full-length cDNA","Novel full-length cDNAs are provided. 2443 cDNA derived from human have been isolated. The full-length nucleotide sequences of the cDNA and amino acid sequences encoded by the nucleotide sequences have been determined. Because the cDNA of the present invention are full-length and contain the translation start site, they provide information useful for analyzing the functions of the polypeptide.",helix res inst[us],isogai takao[jp]; sugiyama tomoyasu[jp]; otsuki tetsuji[jp]; wakamatsu ai[jp]; sato hiroyuki[jp]; ishii shizuko[jp]; yamamoto jun-ichi[jp]; isono yuuko[jp]; hio yuri[jp]; otsuka kaoru[jp]; nagai keiichi[jp]; irie ryotaro[jp]; tamechika ichiro[jp]; seki naohiko[jp]; yoshikawa tsutomu[jp]; otsuka motoyuki[jp]; nagahari kenji[jp]; masuho yasuhiko[jp],20040108,C07K14/47;G01N33/566;G01N2500/00
34193185,"COMPOSITIONS AND METHODS FOR THE TREATMENT OF IMMUNE RELATED DISEASES","The present invention relates to composition containing novel proteins and method of using those compositions for the dignosis and treatment of immune related diseases.",genentech inc[us]; abbas alexander[us]; clark hilary[us]; ouyang wenjun[us]; williams mickey p[us]; wood william i[us]; wu thomas d[us],abbas alexander[us]; clark hilary[us]; ouyang wenjun[us]; williams mickey p[us]; wood william i[us]; wu thomas d[us],20050224;20050915,C07K14/47;C12N9/2417;C12Y302/01001;G01N33/564;C12Q1/6837;G01N33/53;G01N33/6893;G01N2800/24;C07K14/47;C12N9/2417;C12Y302/01001;G01N33/564;C12Q1/6837;G01N33/53;G01N33/6893;G01N2800/24
26976741,"DIAGNOSTIC AND THERAPEUTIC COMPOSITIONS AND METHODS WHICH UTILIZE THE T CELL RECEPTOR BETA GENE REGION","The present invention provides isolated nucleic acid molecules encoding a variety of Vbeta genes (e.g., Vbeta25, Vbeta26, Vbeta27, Vbeta28, Vbeta29, Vbeta30 or Vbeta31) as well as both 5' and 3' sequences which flank a T cell receptor beta gene. Also provided are kits of primers and kits of antibodies. Further, the present invention also provides methods for diagnosing organ transplant rejection, as well as methods for determining a correlation between a disease or disease susceptibility and a selected polymorphism.",,hood leroy e[us]; rowen lee[us],20021017,C12Q1/6883;G01N33/6854;C12Q2600/156;C12Q2600/172
69232331,"IMPROVING THE EFFICACY AND SAFETY OF ADOPTIVE CELLULAR THERAPIES","The disclosure relates generally to the generation and use of immune effector cells (e.g., T cells, NK cells) engineered to express an immune receptor (e.g., Chimeric Antigen Receptor, Synthetic Immune Receptor, T Cell Receptor etc.) to treat a disease associated with expression of a target antigen.",univ southern california[us],chaudhary preet[us],20200206,A61K31/496;A61K31/5377;A61K35/17;A61K38/193;A61K45/06;C07K14/7051;C07K14/70578;C07K16/28;C07K16/2803;C07K16/2809;C07K16/2818;C07K16/2875;C07K16/30;C07K16/468;A61K2039/507;A61K2039/5156;A61K2039/585;C07K2317/622;C07K2317/76;C07K2319/03;C07K2319/33
56014752,"NEW TARGETS FOR RNA THERAPEUTICS","The present invention relates to a method for treating or preventing a disease, disorder or condition by administration of a polynucleotide, e.g. a modified RNA, encoding a peptide or protein related to this disease, disorder or condition. The present invention also relates to pharmaceutical compositions for use in such method.",curevac ag[de],hoerr ingmar[de],20180510,A61K9/0014;A61K9/0014;A61K9/0019;A61K48/00;A61K48/005;C07K14/00;A61K39/00;A61K48/0075;A61K48/0075
77273610,"ENGINEERED SAFETY IN CELL THERAPY","The present disclosure relates to compositions and methods for treating cancer. For example, a modified cell may include a polynucleotide comprising an NFAT promoter, a nucleotide sequence encoding therapeutic agent, and a nucleotide sequence encoding a VHL-interaction domain of HIF1α, wherein the therapeutic agent comprises, for example, IL-12, IL-6, and/or IFNγ.",innovative cellular therapeutics holdings ltd[ky]; innovative cellular therapeutics inc[us],pu chengfei[cn]; cao zhiyuan[cn]; wu zhao[cn]; xiao lei[us],20210819,A61K35/17;A61K35/17;A61K39/0011;A61K39/001112;A61K39/001193;A61P35/00;C07K14/4702;C07K14/535;C07K14/5412;C07K14/5412;C07K14/5418;C07K14/5434;C07K14/5434;C07K14/5443;C07K14/55;C07K14/57;A61K2039/5156;A61K2039/55538;A61K2039/868
37856185,"Novel nucleic acids and polypeptides","The present invention provides novel nucleic acids, novel polypeptide sequences encoded by these nucleic acids and uses thereof.",,tang y tom[us]; liu chenghua[us]; drmanac radoje t[us],20070315,C07K14/47
75273806,"PRESENTING CELL AND USE THEREOF IN CELL THERAPY","The present disclosure relates to compositions and methods for enhancing T cell response and/or CAR cell expansion and/or maintenance in vivo and/or in vitro. For example, in a method of in vivo cell expansion, the method comprises administering an effective amount of cells comprising an antigen binding molecule to a subject; and administering an effective amount of presenting cells expressing a solid tumor antigen that the binding molecule binds.",innovative cellular therapeutics holdings ltd[ky]; innovative cellular therapeutics inc[us],xiao lei[us]; pu chengfei[cn]; cao zhiyuan[cn]; wu zhao[cn]; tian le[us],20210408,A61K35/17;A61K35/17;A61K38/208;A61K39/39541;A61K48/005;A61P35/00;A61P35/00;C07K16/28;C07K16/2803;C07K16/2809;C07K16/3092;C07K16/40;A61K38/217;A61K2039/505;C07K2317/24;C07K2317/31;C07K2317/622;C12N2740/16043
24308584,"NOVEL NUCLEIC ACIDS AND POLYPEPTIDES","The present invention provides novel nucleic acids, novel polypeptide sequences encoded by these nucleic acids and uses thereof.",hyseq inc[us]; tang y tom[us]; liu chenghua[us]; drmanac radoje t[us],tang y tom[us]; liu chenghua[us]; drmanac radoje t[us],20011122;20021031,C07K14/47;A61K38/00;A61K2039/505;C07K14/47;A61K38/00;A61K2039/505
74680524,"COUPLED REDIRECTED CELLS AND USES THEREOF","The present disclosure relates to compositions and methods of enhancing expansion of a population of cells targeting a solid tumor and/or enhancing treatment on the solid tumor using the population of cells. For example, the method comprises administering an effective amount of a composition comprising a first population of cells targeting a WBC antigen and a second population of cells targeting the solid tumor to a subject having the solid tumor; and allowing the second population of cells to expand, wherein there are at least as many or more of the second population of cells targeting the solid tumor than the first population of cells targeting the WBC antigen.",innovative cellular therapeutics holdings ltd[ky]; innovative cellular therapeutics inc[us],xiao lei[us]; pu chengfei[cn]; cao zhiyuan[cn]; wu zhao[cn]; tian le[us],20210304,A61K35/17;A61K35/17;A61K38/204;A61K38/208;A61K38/208;A61K38/217;A61K38/217;A61K39/0011;A61K39/001112;A61K39/00117;C12N5/0638;C12N5/0646;A61K2039/5156;C12N2510/00
38834449,"Cytotoxic T-lymphocyte-inducing immunogens for prevention, treatment, and diagnosis of cancer","The present invention relates to compositions and methods for the prevention, treatment, and diagnosis of cancer, especially carcinomas, such as ovarian carcinoma. The invention discloses peptides, polypeptides, and polynucleotides that can be used to stimulate a CTL response against cancer.",immunotope inc[us],ramakrishna venky[us]; ross mark m[us]; philip ramila[us],20110405,A61K9/127;A61K38/18;A61K38/19;A61K39/0011;C07K14/47;C07K14/4738;C07K14/4748;C07K14/485;C07K14/705;C07K14/70546;C07K14/71;C12N5/0636;G01N33/57484;A61K39/00;A61K2039/5154;A61K2039/5158;A61K2039/522;A61K2039/53
52583579,"MODIFIED POLYNUCLEOTIDES FOR THE PRODUCTION OF PROTEINS","The invention relates to compositions and methods for the preparation, manufacture and therapeutic use of polynucleotides, primary transcripts and mmRNA molecules.",moderna therapeutics inc[us],bancel stephane[us]; chakraborty tirtha[us]; de fougerolles antonin[be]; elbashir sayda m[us]; ellsworth jeff lynn[us]; ejebe kenechi[us]; guild justin[us]; john matthias[us]; hatala paul[us]; roy atanu[us]; schrum jason p[us]; whoriskey susan[us]; wood kristy m[us],20160602,A61K9/1271;A61K9/1271;A61K9/145;A61K9/5123;A61K9/5146;A61K9/5153;A61K31/7115;A61K38/17;A61K38/17;A61K38/177;A61K38/1816;A61K38/1816;A61K38/1891;A61K38/1891;A61K38/191;A61K38/191;A61K38/193;A61K38/193;A61K38/212;A61K38/212;A61K38/45;A61K38/45;A61K38/4846;A61K38/4846;A61K47/543;A61K47/543;A61K48/0033;A61K48/005;A61K48/005;A61K48/0066;A61K48/0066;A61K48/0075;C07K14/005;C07K14/435;C07K14/435;C07K14/47;C07K14/47;C07K14/4705;C07K14/4705;C07K14/4713;C07K14/4713;C07K14/485;C07K14/485;C07K14/505;C07K14/505;C07K14/515;C07K14/525;C07K14/535;C07K14/535;C07K14/56;C07K14/62;C07K14/62;C07K14/705;C07K14/705;C07K16/00;C07K16/00;C12N9/1051;C12N9/16;C12N9/2402;C12N9/2445;C12N9/644;C12N9/6451;C12N9/88;C12N9/93;C12N9/93;C12N15/11;C12N15/52;C12N15/85;C12N15/85;C12N15/87;C12N15/87;C12P13/04;C12P21/00;C12P21/005;C12Y603/02019;C12Y603/02019;A61K38/00;C12Y304/21022;C12Y304/21022
29741157,"Novel nucleic acids and polypeptides","The present invention provides novel nucleic acids, novel polypeptide sequences encoded by these nucleic acids and uses thereof.",nuvelo inc[us],tang y t[us]; liu chenghua[us]; asundi vinod[us]; chen rui-hong[us]; qian xiaohong b[us]; wang zhi w[us]; wehrman tom[us]; zhang jie[us]; zhou ping[us]; cao yicheng[cn]; drmanac radoje t[us],20051201,C07K14/705;C07K14/70503;C07K14/715;C07K14/775;C07K16/00;C07K14/47;C12Y304/21006;C12N9/16;C12N9/6432;A61K38/00
65362959,"ANTIGEN-BINDING PROTEINS TATRGETING SHARED ANTIGENS","Provided herein are HLA-PEPTIDE targets and antigen binding proteins that bind HLA-PEPTIDE targets. Also disclosed are methods for identifying the HLA-PEPTIDE targets as well as identifying one or more antigen binding proteins that bind a give n HLA-PEPTIDE target.",gritstone oncology inc[us]; francis joshua michael[us]; grotenbreg gijsbert marnix[us],francis joshua[us]; grotenbreg gijsbert[us]; jooss karin[us]; blair wade[us]; bulik-sullivan brendan[us]; busby jennifer[us]; busby michelle[us]; skoberne mojca[us]; yelensky roman[us],20190221,A61K39/0011;A61K39/001184;A61K39/001186;A61K39/001188;A61K39/001191;C07K14/7051;C07K16/2833;C07K16/30;C07K16/3069;G01N33/57492;A61K2039/5156;A61K2039/5158;A61K2039/605;C07K2317/32;C07K2317/34;C07K2317/55;C07K2317/622;C07K2317/92;G01N2333/70539;G01N2500/10
24829830,"Compositions and methods for the therapy and diagnosis of lung cancer","Compositions and methods for the therapy and diagnosis of cancer, particularly lung cancer, are disclosed. Illustrative compositions comprise one or more lung tumor polypeptides, immunogenic portions thereof, polynucleotides that encode such polypeptides, antigen presenting cell that expresses such polypeptides, and T cells that are specific for cells expressing such polypeptides. The disclosed compositions are useful, for example, in the diagnosis, prevention and/or treatment of diseases, particularly lung cancer.",,reed steven g[us]; lodes michael j[us]; mohamath raodoh[us]; secrist heather[us]; benson darin r[us]; indirias carol yoseph[us]; henderson robert a[us]; fling steven p[us]; algate paul a[us]; elliott mark[us]; mannion jane[us]; kalos michael d[us],20020815,C07K14/47;C07K2319/00
38997596,"GENEMAP OF THE HUMAN GENES ASSOCIATED WITH PSORIASIS","The present invention relates to the selection of a set of polymorphism markers for use in genome wide association studies based on linkage disequilibrium mapping. In particular, the invention relates to the fields of pharmacogenomics, diagnostics, patient therapy and the use of genetic haplotype information to predict an individual's susceptibility to psoriasis disease and/or their response to a particular drug or drugs.",,belouchi abdelmajid[ca]; raelson john verner[ca]; bradley walter edward[ca]; paquian bruno[ca]; nguyen-huu quynh[ca]; croteau pascal[ca]; allard rene[ca]; little randall david[ca]; cousineau johanne[ca]; debrus sophie[ca]; keith tim[us]; henderson natali[ca]; dubois daniel[ca]; van eerdewegh paul[us]; segal jonathan[us],20100513,C12Q1/6883;C12Q2600/156;C12Q2600/158;C12Q2600/172
59965309,"A HIGHLY SENSITIVE AND SPECIFIC LUCIFERASE BASED REPORTER ASSAY FOR ANTIGEN DETECTION","Provided herein are methods for detecting an antigen or for detecting expression of a chimeric antigen receptor (CAR). The methods include obtaining a sample from a subject, contacting the sample with a fusion protein comprising a reporter fused to a single chain antibody specific to the antigen or fused to an extracellular domain of an antigen targeted by the CAR or fused to Protein L and assaying the activity of the reporter, wherein presence of reporter activity or increase in reporter activity relative to a reference value is indicative of presence of the antigen or presence of the expression of the chimeric antigen receptor in the sample.",univ southern california[us],chaudhary preet m[us],20171005,G01N33/5023;G01N33/5044;G01N33/535;G01N33/536;G01N33/56966;G01N33/56972;G01N33/581;C07K2319/60;G01N2333/70503;G01N2333/72;G01N2800/52
27582761,"Compositions and methods for the therapy and diagnosis of lung cancer","Compositions and methods for the therapy and diagnosis of cancer, particularly lung cancer, are disclosed. Illustrative compositions comprise one or more lung tumor polypeptides, immunogenic portions thereof, polynucleotides that encode such polypeptides, antigen presenting cell that expresses such polypeptides, and T cells that are specific for cells expressing such polypeptides. The disclosed compositions are useful, for example, in the diagnosis, prevention and/or treatment of diseases, particularly lung cancer.",corixa corp[us],algate paul a[us]; lodes michael j[us]; wang tongtong[us]; fan liqun[us]; mcneill patricia d[us],20030626,C07K14/47;G01N33/57423;A61K38/00;A61K39/00;A61K2039/5158;C07K2319/00
31993624,"Novel nucleic acids and polypeptides","The present invention provides novel nucleic acids, novel polypeptide sequences encoded by these nucleic acids and uses thereof.",,tang y tom[us]; liu chenghua[us]; drmanac radoje t[us],20040318,C07H21/04;C07K14/47
63963486,"HPV-SPECIFIC BINDING MOLECULES","Provided are binding molecules, such as TCRs or antigen binding fragments thereof and antibodies and antigen-binding fragments thereof, such as those that recognize or bind human papilloma virus (HPV) 16, including HPV 16 E6 and HPV 16 E7. Also provided are engineered cells containing such binding molecules, compositions containing the binding molecules or engineered cells, and methods of treatment, such as administration of the binding molecules, engineered cells, or compositions.",juno therapeutics inc[us]; editas medicine inc[us],brandt cameron[us]; belmont brian[us]; borges christopher[us]; burleigh stephen michael[us]; croft alexandra[us]; goldfless stephen jacob[us]; huss david jeffrey[us]; jiang yue[us]; johnstone timothy g[us]; koppstein david[us]; nguyen hieu[us]; nye christopher heath[us]; peper haley[us]; sather blythe d[us]; timberlake sonia[us]; toy dean y[us]; vong queenie[us]; welstead g[us],20190411,C07K14/7051;C07K16/084;C07K16/2833;C07K2317/32;C07K2319/03
39760280,"GENEMAP OF THE HUMAN GENES ASSOCIATED WITH SCHIZOPHRENIA","The present invention relates to the selection of a set of polymorphism markers for use in genome wide association studies based on linkage disequilibrium mapping. In particular, the invention relates to the fields of pharmacogenomics, diagnostics, patient therapy and the use of genetic haplotype information to predict an individual's susceptibility to SCHIZOPHRENIA disease and/or their response to a particular drug or drugs.",genizon biosciences inc,belouchi abdelmajid[ca]; raelson john verner[ca]; bradley walter edward[ca]; paquin bruno[ca]; fournier helene[ca]; croteau pascal[ca]; paquin nouzha[ca]; dubois daniel[ca]; bruat vanessa[ca]; van eerdewegh paul[us]; segal jonathan[il]; little randall david[us]; keith tim[us],20100610,C12Q1/6883;C12Q2600/156;C12Q2600/172;Y10T436/143333;Y10T436/143333
66182684,"T CELL RECEPTORS AND ENGINEERED CELLS EXPRESSING SAME","Provided herein are binding molecules, such as those that recognize or bind a peptide epitope of a cancer antigen, such as expressed on a cancer cell, including cells infected with human papilloma virus (HPV) or that contain HPV DNA sequences and/or those that recognize or bind a peptide epitope of HPV 16 E6 or E7, in the context of a major histocompatibility complex (MHC) molecule. Among the provided binding molecules are T cell receptors (TCRs) or antibodies, including antigen-binding fragments thereof, that bind or recognize such peptide epitopes. The present disclosure further relates to engineered cells comprising such binding molecules, e.g., TCRs or antibodies (and chimeric antigen receptors containing the antibodies), and uses thereof in adoptive cell therapy.",juno therapeutics inc[us],goldfless stephen jacob[us]; belmont brian[us]; brandt cameron[us]; croft alexandra[us]; huss david jeffrey[us],20191010,A61K35/17;A61P31/20;A61P35/00;C07K14/025;C07K14/025;C07K14/7051;C07K14/7051;C07K16/084;C07K16/2833;C12N15/86
37804679,"Full-length cDNA","Novel full-length cDNAs are provided. 1,995 cDNA derived from human have been isolated. The full-length nucleotide sequences of the cDNA and amino acid sequences encoded by the nucleotide sequences have been determined. Because the cDNA of the present invention are full-length and contain the translation start site, they provide information useful for analyzing the functions of the polypeptide.",res ass for biotechnology,isogai takao[jp]; yamamoto junichi[jp]; nishikawa tetsuo[jp]; isono yuko[jp]; sugiyama tomoyasu[jp]; otsuki tetsuji[jp]; wakamatsu ai[jp]; ishii shizuko[jp]; nagai keiichi[jp]; irie ryotaro[jp],20070301,C07K14/47
71947815,"COMBINATION GENE TARGETS FOR IMPROVED IMMUNOTHERAPY","The present disclosure provides methods and compositions related to the modification of immune effector cells to increase therapeutic efficacy. In some embodiments, immune effector cells modified to reduce expression of one or more endogenous target genes, or to reduce one or more functions of an endogenous protein to enhance effector functions of the immune cells are provided. In some embodiments, immune effector cells further modified by introduction of transgenes conferring antigen specificity, such as exogenous T cell receptors (TCRs) or chimeric antigen receptors (CARs) are provided. Methods of treating a cell proliferative disorder, such as a cancer, using the modified immune effector cells described herein are also provided.",ksq therapeutics inc[us],benson micah[us]; schlabach michael[us]; kryukov gregory[us]; cadzow anne louise[us]; fleur le mercier isabelle[us]; stegmeier frank[us],20200813;20200924,A61K35/17;A61K49/0004;C12N5/0636;C12N9/22;C12N15/11;C12N15/11;C12N15/86;C12N2310/14;C12N2310/20;C12N2310/531;C12N2510/00;C12N2740/15043;C12N2800/80;A61K35/17;A61K49/0004;C12N5/0636;C12N9/22;C12N15/11;C12N15/11;C12N15/86;C12N2310/14;C12N2310/20;C12N2310/531;C12N2510/00;C12N2740/15043;C12N2800/80
39789174,"GENEMAP OF THE HUMAN GENES ASSOCIATED WITH ADHD","The present invention relates to the selection of a set of polymorphism markers for use in genome wide association studies based on linkage disequilibrium mapping. In particular, the invention relates to the fields of pharmacogenomics, diagnostics, patient therapy and the use of genetic haplotype information to predict an individual's susceptibility to ADHD disease and/or their response to a particular drug or drugs.",genizon biosciences inc[ca],belouchi abdelmajid[ca]; bruat vanessa[ca]; croteau pascal[ca]; dubois daniel[ca]; little randall david[ca]; paquin bruno[ca]; raelson john verner[ca]; segal jonathan[il]; van eerdewegh paul[us]; briand sandie[ca]; kebache sem[ca]; keith tim[us],20100513,C12Q1/6883;G16B5/00;C12Q2600/172;G16B20/00;G16B30/00
27066367,"NOVEL NUCLEIC ACIDS AND POLYPEPTIDES","The present invention provides novel nucleic acids, novel polypeptide sequences encoded by these nucleic acids and uses thereof.",hyseq inc[us]; drmanac rodoje t[us]; liu chenghua[us]; tang y tom[us],drmanac rodoje t[us]; liu chenghua[us]; tang y tom[us],20011011;20020404;20021031;20041014,C07K14/47;C07K14/8107;A61K38/00;C07K14/47;C07K14/8107;A61K38/00;C07K14/47;C07K14/8107;A61K38/00;C07K14/47;C07K14/8107;A61K38/00
27571149,"Human genome-derived single exon nucleic acid probes useful for gene expression analysis","Methods and apparatus for predicting, confirming and displaying functional regions from genomic sequence data are used to identify 16,834 unique human genome-derived single exon probes useful for gene expression analysis, particularly gene expression analysis by microarray. Also presented are genome-derived single exon microarrays that include such probes, peptides encoded by the exons, and antibodies thereto.",,penn sharron gaynor[us]; rank david russell[us]; chen wensheng[us]; hanzel david kagen[us],20020425,C07K14/705;C07K14/47;C07K14/4748;C12Q1/6809;C12Q1/6837;C12Q1/6876;C12Q1/6883;C12Q1/6886;C12N15/1034;G16B30/00;A61K38/00;A01K2217/05;A01K2217/075;C07K2319/00;C07K2319/02;C07K2319/40;C07K2319/60;C12Q2600/156;C12Q2600/158;G16B25/00
32601066,"Compositions and methods for the therapy and diagnosis of lung cancer","Compositions and methods for the therapy and diagnosis of cancer, particularly lung cancer, are disclosed. Illustrative compositions comprise one or more lung tumor polypeptides, immunogenic portions thereof, polynucleotides that encode such polypeptides, antigen presenting cell that expresses such polypeptides, and T cells that are specific for cells expressing such polypeptides. The disclosed compositions are useful, for example, in the diagnosis, prevention and/or treatment of diseases, particularly lung cancer.",corixa corp[us],lodes michael j[us]; mohamath raodoh[us]; henderson robert a[us]; benson darin r[us]; secrist heather[us],20040706,C07K14/47;C07K14/4748;A61K38/00;A61K39/00;C07K2319/00;Y02A50/396
61906057,"COMPOSITIONS AND METHODS FOR PREDICTING RESPONSE AND RESISTANCE TO CTLA4 BLOCKADE IN MELANOMA USING A GENE EXPRESSION SIGNATURE","The present invention relates to compositions and methods for predicting response and resistance to CTA4 blockade in melanoma.",dana farber cancer inst inc[us],bachireddy pavan[us]; shukla sachet a[us]; wu catherine j[us],20191003,A61P35/00;A61P35/00;C07K16/24;C07K16/2818;C07K16/2818;C07K16/30;C12Q1/68;C12Q1/6886;C12Q1/6886;G01N33/5743;A61K2039/505;A61K2039/505;A61K2039/507;A61K2039/545;C07K2317/76;C07K2317/76;C12Q2600/106;C12Q2600/106;C12Q2600/154;C12Q2600/158;C12Q2600/158;G01N2800/52
