family,title,abstract,applicants,inventors,dates,classes
38834845,"POLYPEPTIDES","There is disclosed a polypeptide consisting of between 7 and 100 amino acids and comprising: the sequence of the peptide of any one of SEQ. ID NOS: 1 to 145. There is also disclosed a T-cell receptor, or a peptide-binding fragment thereof, wherein the CDR3 region of the beta chain of the T-cell receptor comprises a glycine residue at position 5 from the N-terminus. The T-cell receptor is capable of binding a peptide consisting of the sequence of SEQ. ID NO. 18, when the peptide is presented on an HLA molecule of a first HLA allele.",medinnova as,olweus johanna petra[no]; lund-johansen fridtjof[no]; walchli philippe sebastien[no]; stronen erlend[no]; johansen jorunn[no],20110616,A61K35/17;A61K39/0011;C07K14/7051;A61K38/00;A61K2039/5158
55952398,"PEPTIDES","The present invention relates to novel peptides derived from Progesterone-associated endometrial protein (PAEP), complexes comprising such peptides bound to recombinant MHC molecules, and cells presenting said peptide in complex with MHC molecules. Also provided by the present invention are binding moieties that bind to the peptides and/or complexes of the invention. Such moieties are useful for the development of immunotherapeutic reagents for the treatment of diseases such as cancer.",immunocore ltd[gb]; adaptimmune ltd[gb],powlesland alex[gb]; bombik izabela[gb]; mai nicole[gb]; sayer christopher[gb],20170921,C12N15/62;A61K39/0011;C07K14/4748;G01N33/5011;A61K2039/605;G01N2500/10;C07K14/7051
74647332,"PEPTIDES OF PAGE5","The present invention relates to novel peptides derived from P antigen family member 5 (PAGE5), complexes comprising such peptides bound to recombinant MHC molecules, and cells presenting said peptide in complex with MHC molecules. Also provided by the present invention are binding moieties that bind to the peptides and/or complexes of the invention. Such moieties are useful for the development of immunotherapeutic reagents for the treatment of diseases such as cancer.",immunocore ltd[gb]; adaptimmune ltd[gb],powlesland alex[gb]; sun meidai[gb],20210225,A61K38/1774;A61K38/1774;A61K39/0011;A61K39/001102;A61K39/001184;A61K39/001193;C07K14/4748;C07K14/7051;C07K14/70539;C07K14/70539;C07K16/2833;C07K16/30;C07K16/30;C07K16/3069;G01N33/6845;A61K39/00;A61K2039/804;C07K2317/92;C07K2319/00;G01N2333/7051;G01N2333/70539;G01N2800/7028
54939086,"Recombinant human progenitor cells, engineered human thymocytes, and engineered human T cells","Disclosed herein are recombinant human progenitor cells, engineered human thymocytes, and engineered human T cells. The recombinant human progenitor cells are made by transducing a human hematopoietic stem cell with a vector having a nucleic acid molecule which encodes a human T cell receptor specific to a virus, such as Human Immunodeficiency Virus, or an epitope thereof. The recombinant human progenitor cells differentiate and mature into the engineered human thymocytes and the engineered human T cells. Also disclosed herein are methods of inhibiting, reducing or treating a viral infection in a subject, such as a human subject, which comprises administering recombinant human progenitor cells, engineered human thymocytes, and/or engineered human T cells to the subject.",kitchen scott g[us]; zack jerome a[us]; yang otto o[us]; bennett michael s[us]; arumugam balamurugan[us]; univ california[us],kitchen scott g[us]; zack jerome a[us]; yang otto o[us]; bennett michael s[us]; arumugam balamurugan[us],20160105,C07K14/7051;C07K14/7051;C12N5/0636;C12N5/065;A61K2039/5156;A61K2039/5158;C12N2510/00
67806416,"Neoantigen Identification with Pan-Allele Models","A method for identifying neoantigens that are likely to be presented by MHC alleles on a surface of tumor cells of a subject. Peptide sequences of the tumor neoantigens and of the MHC alleles are obtained by sequencing the tumor cells of the subject. The peptide sequences of the tumor neoantigens and of the MHC alleles are input into a machine-learned presentation model to generate presentation likelihoods for the tumor neoantigens, each presentation likelihood representing the likelihood that a neoantigen is presented by at least one of the MHC alleles on the surface of the tumor cells of the subject. A subset of the neoantigens is selected based on the presentation likelihoods.",gritstone oncology inc[us],boucher thomas francis[us]; bulik-sullivan brendan[us]; busby jennifer[us]; skoberne mojca[us]; yelensky roman[us],20201231,C12Q1/6869;C40B30/04;C40B30/04;C40B30/04;G01N33/6848;G16B20/20;G16B20/20;G16B20/20;G16B20/20;G16B30/10;G16B30/10;G16B30/20;G16B40/00;G16B40/00;G16B40/00;G16B40/20;G16B40/20;G16B40/20;G01N33/6848;G01N33/6848;G01N2333/70539;G01N2333/70539;G01N2333/70539;G16B30/10
63371468,"HA-1 SPECIFIC T CELL RECEPTORS AND THEIR USE","The present invention covers an isolated T cell receptor (TCR) specific for one allelic variant of minor histocompatibility antigen 1 (HA-l), in particular the allelic variant HA-lH. An isolated polypeptide comprising a functional portion of the TCR is also described. Moreover, a multivalent TCR complex, nucleic acid molecules, vectors, cells, antibodies as well as medical uses that relate to the TCR are defined.",medigene immunotherapies gmbh[de],ellinger christian[de]; sommermeyer daniel[de]; bracher aline[de],20200213,C07K14/7051;C07K16/2833
43649661,"TREATMENT OF DISEASES CAUSED BY BACTERIAL EXOTOXINS","Provided are high affinity T cell receptor variable regions that are useful for treating diseases caused by superantigens including atopic dermatitis, pneumonia and delayed wound healing. The variable regions contain mutants that result in high affinity binding to the superantigen.",univ illinois[us]; univ minnesota[us]; kranz david m[us]; schlievert patrick[us],kranz david m[us]; schlievert patrick[us],20110310,C07K14/7051;A61K38/00
57757079,"HUMANIZED OR CHIMERIC CD3 ANTIBODIES","The present invention relates to humanized or chimeric antibodies binding CD3. It furthermore relates to bispecific antibodies, compositions, pharmaceutical compositions, use of said antibodies in the treatment of a disease, and method of treatment.",genmab as[dk],rademaker rik[nl]; altintas isil[nl]; engelberts patrick[nl]; schuurman janine[nl]; parren paul[nl],20170119,C07K16/2809;C07K16/32;A61K2039/505;C07K2317/24;C07K2317/31;C07K2317/526;C07K2317/55;C07K2317/565;C07K2317/73;C07K2317/92
61245300,"PROTEOLYTICALLY CLEAVABLE CHIMERIC POLYPEPTIDES AND METHODS OF USE THEREOF","The instant disclosure provides chimeric polypeptides which modulate various cellular processes following a cleavage event induced upon binding of a specific binding member of the polypeptide with its binding partner. Methods of using chimeric polypeptides to modulate cellular functions, including e.g., induction of gene expression, are also provided. Nucleic acids encoding the subject chimeric polypeptides and associated expression cassettes and vectors as well as cells that contain such nucleic acids and/or expression cassettes and vectors are provided. Also provided, are methods of treating a subject using the described components and methods as well as kits for practicing the subject methods.",univ california[us],lim wendell a[us]; roybal kole t[us]; williams jasper z[us],20180301,A61K35/17;A61K39/39558;A61P35/00;A61P35/00;A61P37/00;C07K14/4705;C07K14/705;C07K14/705;C07K14/705;C07K14/7051;C07K14/7051;C07K14/70539;C07K14/70539;C07K16/2803;C07K16/2803;C07K16/2803;C07K16/2809;C07K16/2809;C07K16/2809;C07K16/2833;C07K16/2833;C07K16/2833;C07K16/30;C12N15/63;C12N15/63;A61K2039/505;A61K2039/505;C07K2317/14;C07K2317/14;C07K2317/31;C07K2317/31;C07K2317/31;C07K2317/32;C07K2317/32;C07K2317/622;C07K2317/622;C07K2319/00;C07K2319/00;C07K2319/50;C07K2319/50;C07K2319/50;C07K2319/60;C07K2319/60;C07K2319/60;C07K2319/715;C07K2319/715;C07K2319/80;C07K2319/80
50687372,"GLYPICAN-3-SPECIFIC T-CELL RECEPTORS AND THEIR USES FOR IMMUNOTHERAPY OF HEPATOCELLULAR CARCINOMA","The present invention relates to glypican-3-specific T-cell receptors. The present invention further relates to soluble TCR constructs, chimeric TCRs, bi-specific antibodies, nucleic acids, expression constructs and cells comprising said TCRs or TCR constructs. The present invention further relates to the use of the TCR or the soluble TCR constructs or chimeric TCRs or bi-specific antibodies as a medicament, preferably in the detection, diagnosis, prognosis, prevention and/or treatment of liver cancer, in particular hepatocellular carcinoma, or other cancers expressing GPC3. The present invention further relates to methods of detecting, diagnosing, prognosing, preventing and/or treating liver cancer, in particular hepatocellular carcinoma, or other cancers expressing GPC3. The present invention further relates to peptides comprising glypican-3 epitope(s) and respective nucleic acids encoding them, antibodies and compositions as well as their use as (peptide) vaccines. The present invention further relates to vaccines comprising the peptide(s).",tech universität münchen[de],protzer ulrike[de]; dargel christina[de],20151119,A61K35/17;A61K39/0011;C07K14/4725;C07K14/705;C07K14/7051;C07K14/7051;C07K16/18;C12N5/0636;G01N33/57438;C07K2317/31;C07K2317/622;C07K2319/00;C07K2319/21;C07K2319/43;C07K2319/70;C12N2510/00;G01N2333/705
56985682,"NY-ESO-1 SPECIFIC TCRS AND METHODS OF USE THEREOF","The present disclosure relates to NY-ESO-1 specific TCR amino acid sequences and methods of their use.",immune design corp[us],lu hailing[us]; ter meulen jan henrik[us],20170316,A61K38/1774;A61K31/7016;A61P35/00;C07K14/7051;A61K9/0019;A61K45/06;G01N33/57492;C07K2319/03;C07K2319/035
55133165,"PEPTIDES","The present invention relates to novel peptides derived from Calcium homeostasis modulator protein 3 (CALHM3), complexes comprising such peptides bound to recombinant MHC molecules, and cells presenting said peptide in complex with MHC molecules. Also provided by the present invention are binding moieties that bind to the peptides and/or complexes of the invention. Such moieties are useful for the development of immunotherapeutic reagents for the treatment of diseases such as cancer.",immunocore ltd[gb]; adaptimmune ltd[gb],powlesland alex[gb]; pentier johanne[gb]; gilgunn sarach[gb]; galfre elena[gb],20181115,C07K7/06;C07K14/4702;C07K14/4702;C07K14/4748;C07K14/7051;C07K14/70539;C07K16/18;G01N33/6872;A61K38/00;A61K38/00;C07K2319/00;G01N2333/4703;G01N2333/7051;G01N2333/70539;G01N2333/70539
60856957,"T CELL RECEPTORS FOR TUMOR SPECIFIC PROTEASOME SPLICE VARIANTS AND USES THEREOF","The present invention pertains to antigen recognizing constructs against tumor specific proteasome splicing variants. The invention in particular provides novel T cell receptor (TCR) based molecules which are selective and specific for tumor cells carrying antigenic epitopes generated by proteasome peptide splicing of tumor specific antigens. The TCRs of the invention, and antigen binding fragments derived therefrom, are of use for the diagnosis, treatment and prevention of proliferative diseases, preferably for the treatment of cancer. Further provided are nucleic acids encoding the antigen recognizing constructs of the invention, vectors comprising these nucleic acids, recombinant cells expressing the antigen recognizing constructs and pharmaceutical compositions comprising the compounds of the invention.",max delbrueck centrum fuer molekulare medizin helmholtz gemeinschaft[de]; deutsches krebsforschungszentrum stiftung des oeffentlichen rechts[de]; imperial college innovations ltd[gb]; univ berlin charite[de],blankenstein thomas[de]; willimsky gerald[de]; liepe juliane[de]; kloetzel peter michael[de]; mishto michele[gb]; beier christin[de],20210304,A61K38/00;A61K39/00;C07K14/7051;C07K14/7051;C07K14/82;A61K35/17;A61K38/00;C07K16/32;C07K2317/34;C07K2317/565
66438683,"MAJOR HISTOCOMPATIBILITY COMPLEX-BASED CHIMERIC RECEPTORS AND USES THEREOF FOR TREATING AUTOIMMUNE DISEASES","Major histocompatibility complex-based chimeric receptors (MHC-CAR) for use in targeting autoreactive immune cells. Also provided herewith are genetically engineered immune cells expressing the MHC-CAR for use in treating autoimmune diseases such as multiple sclerosis.",jura bio inc[us],norville julie[us]; wood elizabeth[us],20210610,A61K35/17;A61K35/17;A61K35/17;A61K35/17;A61K38/00;A61P35/00;A61P35/00;C07K14/7051;C07K14/7051;C07K14/7051;C07K14/7051;C07K14/70521;C07K14/70521;C07K14/70521;C07K14/70521;C07K14/70539;C07K14/70539;C07K14/70539;C07K14/70539;C07K14/70596;C07K14/70596;C07K16/2833;C07K16/2833;C12N15/85;C12N15/85;A61K38/00;C07K16/2833;C07K2317/32;C07K2317/32;C07K2317/32;C07K2319/02;C07K2319/02;C07K2319/02;C07K2319/03;C07K2319/03;C07K2319/03;C07K2319/33;C07K2319/33;C07K2319/33
68084937,"COMPOSITIONS AND METHODS FOR TCR REPROGRAMMING USING FUSION PROTEINS","Provided herein are T cell receptor (TCR) fusion proteins (TFPs) having specificity for more than one tumor cell associated antigen, T cells engineered to express one or more TFP, and methods of use thereof for the treatment of diseases, including cancer.",tcr2 therapeutics inc[us],baeuerle patrick alexander[de]; hofmeister robert[us]; ding jian[us]; ashminova vania[us]; lofgren michael[us],20210819,A61K35/17;A61K35/17;A61K35/17;A61P35/00;C07K14/7051;C07K14/7051;C07K16/28;C07K16/30;C07K16/3092;C07K16/3092;C07K16/3092;C12N5/0636;C12N15/86;A61K38/00;A61K2039/505;A61K2039/5156;A61K2039/5158;C07K2317/22;C07K2317/22;C07K2317/24;C07K2317/569;C07K2317/569;C07K2317/622;C07K2317/622;C07K2319/02;C07K2319/02;C07K2319/03;C07K2319/03;C07K2319/30;C07K2319/33;C12N2510/00;C12N2510/00;C12N2830/50
54293060,"TCR AND USES THEREOF","The present invention relates to a TCR or functional variant thereof having antigenic specificity for CD1c molecules associated with a self-lipid, preferably (mLPA) or derivative thereof, to relative polypeptide, protein, nucleic acid, recombinant expression vector, host cell, population of cells, antibody and pharmaceutical composition. The present invention also relates to the uses of said TCR and relative products, in particular for use in the treatment and/or prevention of an hematological disorder.",ospedale san raffaele srl[it]; fond centro san raffaele[it],casorati giulia[it]; dellabona paolo[it]; de lalla claudia[it]; garavaglia claudio[it],20170406,A61P35/02;C07K14/7051;A61K39/0011;A61K2039/5156
75161609,"PEPTIDES DERIVED FROM TRANSIENT RECEPTOR POTENTIAL CATION CHANNEL SUBFAMILY M MEMBER 1 (TRPM1), COMPLEXES COMPRISING SUCH PEPTIDES BOUND TO MHC MOLECULES","The present invention relates to novel peptides derived from Transient receptor potential cation channel subfamily M member 1 (TRPM1), complexes comprising such peptides bound to recombinant MHC molecules, and cells presenting said peptide in complex with MHC molecules. Also provided by the present invention are binding moieties that bind to the peptides and/or complexes of the invention. Such moieties are useful for the development of immunotherapeutic reagents for the treatment of diseases such as cancer.",immunocore ltd[gb]; adaptimmune ltd[gb],powlesland alex[gb]; kleijnen maurits[gb]; sun meidai[gb],20210401,A61K9/0019;A61K9/5068;A61K47/42;A61K47/42;A61K47/6849;A61K47/6855;A61P35/00;A61P35/00;C07K7/08;C07K14/4748;C07K14/4748;C07K14/705
66493603,"GENETICALLY ENGINEERED γδT CELL","Provided is a genetically engineered γδT cell, which is characterized in that a high-affinity αβTCR gene is transferred into the γδT cell, and the affinity of the high-affinity αβTCR to the specific pMHC thereof is at least two times of that of a wild-type αβTCR corresponding thereto. Further provided are a use of and a preparation method for the γδT cell.",guangzhou inst biomed & health[cn],li yi[cn]; zhou peipei[cn],20190523,A61K39/00;A61P31/00;A61P31/04;A61P31/12;A61P35/00;C12N5/10
59295160,"T CELL RECEPTORS AND USES THEREOF","The present invention relates to the field of biotechnology. Specifically, the invention provides antigen-specific T-cell receptors (TCRs). Further, the invention encompasses polynucleotides encoding the same and vectors comprising said polynucleotides. Host cells comprising the molecules of the invention are also provided. Moreover, the invention provides means and methods for diagnostics and therapy, in particular of cancer.",medigene immunotherapies gmbh[de],ellinger christian[de]; wehner carina[de]; weis manon[de]; wilde susanne[de]; schendel dolores[de],20171221,C07K14/7051;C07K16/3053;C07K14/4748;A61K39/00119;A61K2039/5154;C07K2317/34;C07K2317/73
56297359,"T-CELL RECEPTORS WHICH RECOGNISE FRAMESHIFT MUTANTS OF TGFßRII","The present invention relates to TCR molecules which recognise neopeptides produced as a result of the cancer-associated -1A frameshift mutation in human TGFβRII. The TCR molecules are capable of binding a peptide of SEQ ID NO: 1 when said peptide is presented by a Class I MHC, and comprise an α-chain domain and a β-chain domain, each chain domain comprising three CDR sequences, wherein a) CDRs 1, 2 and 3 of the α-chain domain have the sequences of SEQ ID NOs: 2, 3 and 4 respectively; and b) CDRs 1, 2 and 3 of the β-chain domain have the sequences of SEQ ID NOs: 5, 6 and 7 respectively, and wherein one or more of said CDR sequences may optionally be modified by substitution, addition or deletion of 1 or 2 amino acids. Nucleic acid molecules encoding such TCRs are provided, as are soluble TCR molecules with these CDR sequences. The nucleic acid molecules of the invention can be used to modify immune effector cells to express a TCR as defined herein, and such modified immune effector cells are useful in therapy for cancer, as are soluble TCRs as defined above.",oslo univ hf[no],inderberg else marit[no]; gaudernack gustav[no]; wälchli sèbastien[no]; kvalheim gunnar[no],20171116,A61K35/17;A61K35/17;A61P35/00;C07K14/495;C07K14/495;C07K14/495;C07K14/7051;C07K14/7051;C07K14/7051;C12N5/0636;C12N15/85;A61K38/00;C07K2319/20;C12N2510/00
36000495,"T cell receptors with enhanced sensitivity recognition of antigen","The present invention relates to methods of treating an infectious, proliferative, or lymphocyte-mediated disease that involve providing a T cell receptor beta chain (TCR beta) having higher sensitivity recognition of antigen than a wild type TCR beta chain and introducing the TCR beta chain directly or indirectly to a subject having the disease under conditions effective to treat the disease. Also provided is another method of treating such diseases that involves providing an isolated mouse TCR beta chain having higher sensitivity recognition of antigen than a wild type TCR beta chain, linking the mouse TCR beta chain with a human TCR alphachain, and introducing the linked mouse TCR beta and human TCR alpha chains to a subject having a disease, thereby treating the disease. The present invention also relates to a transgenic mouse having a TCR beta chain having higher sensitivity recognition of antigen than a wild type mouse.",,vukmanovic stanislav[us]; santori fabio r[us]; popmihajlov zoran[us],20060615,C07K14/7051
57965652,"NOVEL T CELL RECEPTORS AND IMMUNE THERAPY USING THE SAME FOR THE TREATMENT OF CANCER AND INFECTIOUS DISEASES","The present invention pertains to antigen recognizing constructs against antigens of the Merkel cell polyomavirus (MCV). The invention in particular provides novel T cell receptor (TCR) based molecules which are selective and specific for the infected host cells and tumor cell expressed MCV derived antigens. The TCR of the invention, and antigen binding fragments derived therefrom, are of use for the diagnosis, treatment and prevention of cancerous diseases. Further provided are nucleic acids encoding the antigen recognizing constructs of the invention, vectors comprising these nucleic acids, recombinant cells expressing the antigen recognizing constructs and pharmaceutical compositions comprising the compounds of the invention.",max delbrueck centrum fuer molekulare medizin in der helmholtz gemeinschaft[de],blankenstein thomas[de]; gavvovidis ioannis[de],20180802,A61K39/0011;A61K39/12;C07K16/081;C07K16/084;G01N33/56983;G01N33/5743;A61K38/00;A61K2039/5158;A61K2039/585;C07K14/7051;C07K2317/32;C12N2710/22034;G01N2333/025;Y02A50/467
66101647,"NEOANTIGEN IDENTIFICATION USING HOTSPOTS","A method for identifying neoantigens that are likely to be presented on a surface of tumor cells of a subject. Peptide sequences of tumor neoantigens are obtained by sequencing the tumor cells of the subject. The peptide sequence of each of the neoantigens is associated with one or more k-mer blocks of a plurality of k-mer blocks of the nucleotide sequencing data of the subject; The peptide sequences and the associated k-mer blocks are input into a machine-learned presentation model to generate presentation likelihoods for the tumor neoantigens, each presentation likelihood representing the likelihood that a neoantigen is presented by an MHC allele on the surfaces of the tumor cells of the subject. A subset of the neoantigens is selected based on the presentation likelihoods.",gritstone oncology inc[us],bulik-sullivan brendan[us]; boucher thomas francis[us]; yelensky roman[us],20190912,C12Q1/6886;G01N33/50;G01N33/56977;G01N33/574;G01N33/6878;C12Q2600/156;C12Q2600/158
63107887,"CHIMERIC T CELL ANTIGEN RECEPTORS AND METHODS OF USE THEREOF","Provided are chimeric T cell antigen receptors (TCR) comprising modified TCR chains. The modified TCR chains include fusion polypeptides having one or more heterologous antigen-binding domains fused to the extracellular domain of the TCR chain. Modified TCR chains also include chains that are modified in various other ways including e.g., chain truncation, cysteine modification, domain swapping and combinations thereof. Also provided are nucleic acids encoding the modified TCR chains as well as nucleic acids encoding the chimeric TCRs and recombinant expression vectors comprising such nucleic acids. Immune cells that are genetically modified or otherwise include the described chimeric TCRs, recombinant expression vectors encoding chimeric TCRs, and/or the described nucleic acids are also provided. Methods are also provided, such as methods of killing a target cell and/or treating a subject for a condition, e.g., through the use of the described chimeric TCRs, nucleic acids, expression vectors and/or immune cells.",univ california[us],o'donoghue geoffrey p[us]; williams jasper z[us]; lim wendell a[us],20180816,C07K14/7051;C07K16/2803;C07K2317/622;C07K2319/03;C07K2319/33
74165587,"ANTIGEN BINDING PROTEINS SPECIFICALLY BINDING MAGE-A","The present invention concerns antigen binding proteins specifically binding melanoma associated antigen A (MAGE-A) protein-derived antigens. The invention in particular provides antigen binding proteins which specifically bind to the MAGE-A antigenic peptide comprising or consisting of SEQ ID NO: 1 in a complex with a major histocombatibility (MHC) protein. The antigen binding proteins of the invention contain, in particular, the complementary determining regions (CDRs) of novel engineered T cell receptors (TCRs) that specifically bind to said MAGE-A peptide/MHC complex. The antigen binding proteins of the invention are of use for the diagnosis, treatment and prevention of MAGE-A expressing cancerous diseases. Further provided are nucleic acids encoding the antigen binding proteins of the invention, vectors comprising these nucleic acids, recombinant cells expressing the antigen binding proteins and pharmaceutical compositions comprising the antigen binding proteins of the invention.",immatics biotechnologies gmbh[de],hutt meike[de]; unverdorben felix[de]; bunk sebastian[de]; maurer dominik[de]; hofmann martin[de]; pszolla gabriele[de]; yousef sara[de]; wagner claudia[de]; schwoebel frank[de]; schuster heiko[de],20210204,A61P35/00;C07K14/7051;C07K14/7051;C07K16/2827;C07K16/30;C07K16/30;C07K16/468;A61K2039/505;A61K2039/5156;C07K2317/24;C07K2317/31;C07K2317/32;C07K2317/33;C07K2317/55;C07K2317/55;C07K2317/565;C07K2317/567;C07K2317/62;C07K2317/622;C07K2317/622;C07K2317/64;C07K2317/73;C07K2317/92;C07K2317/92;C07K2317/94;C07K2319/00;C07K2319/30
55858428,"SURVIVIN SPECIFIC T-CELL RECEPTOR TARGETING TUMOR BUT NOT T CELLS","Embodiments of the disclosure concern engineered T cell receptors that are specific for the survivin tumor antigen but do not have on-target off tumor toxicity. In particular embodiments, particular alpha and beta chains are utilized in engineered T cell receptors for cell therapy that have effective anti-tumor activity but lack fratricidal effects. Methods, compositions, and kits are provided herein.",baylor college medicine[us],savoldo barbara[us]; dotti gianpietro[us]; arber barth caroline eva[us],20160506,C07K14/705;C07K14/7051;C12N5/0636;C12N5/0636;C12N5/0694;C12N5/0694;C12N2510/00;C12N2510/00
68239239,"T CELL RECEPTORS WITH MAGE-B2 SPECIFICITY AND USES THEREOF","The present disclosure provides methods for generating MAGE-B2 specific T cells and compositions comprising engineered MAGE-B2-specific T cell receptors. Further provided are methods of treating cancer comprising administering the MAGE-B2-specific T cells.",univ texas[us],yee cassian[us]; pan ke[us],20191024,A61K35/17;A61K39/00119;A61P35/00;C07K14/00;C07K16/30;C12N5/0636;A61K38/00;A61K2039/5158;C12N2502/1121;C12N2510/00
7675928,"","",,,20041202,C07K14/70596;C07K14/705;C07K14/7051;A61K38/00;C07K2319/00
32505786,"","",,,20060608,C07K14/705;C07K16/3069;C07K14/005;C07K14/47;C07K14/4748;C12N9/6424;G01N33/57434;A61K38/00;A61K39/00;A61K48/00;A01K2227/105;A01K2267/0331;A61K2035/124;A61K2039/505;A61K2039/5156;A61K2039/53;A61K2039/55566;C07K2317/565;C07K2317/73;C07K2319/00;C12N2760/16222
